{
  "artifact_sha256": "1874e2ecb3b6ce2279820bce6e046a018c3fe494d0876c9fded992bcd7f525e6",
  "binary_calibrator": {
    "x_thresholds": [
      0.39889056603773576,
      0.4207801348865726,
      0.42436850393700787,
      0.5371083333333333,
      0.5371119741100323,
      0.5473090909090909,
      0.5473565217391303,
      0.5630373626373626,
      0.5630577181208054,
      0.5652607594936708,
      0.5652796680497925,
      0.5680610169491526,
      0.5680842105263157,
      0.5754714285714285,
      0.5754769230769231,
      0.5819407407407406,
      0.5819445544554455,
      0.5822004866180048,
      0.5822268398268399,
      0.5860842105263158,
      0.5860876712328768,
      0.5923732801595215,
      0.5923873015873016,
      0.5943943661971831,
      0.5943999999999999,
      0.5956523364485982,
      0.5956596685082873,
      0.59668,
      0.5966935779816513,
      0.6015117478510027,
      0.6015151100311076,
      0.6038754098360655,
      0.6038758620689655,
      0.6062394160583942,
      0.6062397932816538,
      0.6069162523900574,
      0.6069185185185184,
      0.6070553191489362,
      0.607056862745098,
      0.6103148936170212,
      0.6103186991869919,
      0.6103770114942529,
      0.6103787234042553,
      0.6114349907918969,
      0.6114354609929079,
      0.6134275689223058,
      0.6134312008616245,
      0.6142138138138138,
      0.6142266978922717,
      0.6157432931902833,
      0.6157444816053511,
      0.6171539267015707,
      0.6171750865051904,
      0.621357264957265,
      0.6213591836734694,
      0.6243079497907951,
      0.6243107142857143,
      0.6253224137931035,
      0.6253247116576535,
      0.625351724137931,
      0.6253584905660378,
      0.6276332563510393,
      0.6276349726775956,
      0.6320019417475728,
      0.6320030425821807,
      0.6338133333333332,
      0.6338207477095777,
      0.6360390423572744,
      0.6360430769230768,
      0.6403453924914676,
      0.6403476286562766,
      0.6424942028985507,
      0.6424952380952379,
      0.6441577092511013,
      0.6441662663317205,
      0.6451272727272728,
      0.6451279742765273,
      0.6456121212121212,
      0.6456142857142857,
      0.6507695652173913,
      0.6507697104677059,
      0.6519082089552238,
      0.6519096821158968,
      0.6565049180327869,
      0.6565077441077442,
      0.668598511166253,
      0.6686004183248521,
      0.6693760956175299,
      0.6693783281733746,
      0.6912958837772397,
      0.6912969072164947,
      0.6913904264577894,
      0.6913910447761193,
      0.6916104857363146,
      0.6916119914346895,
      0.6916312159709619,
      0.6916316708300003,
      0.6917220940550133,
      0.6917222411136101,
      0.6920798418972332,
      0.6920828675852323,
      0.6927550913838119,
      0.692757761559405,
      0.6944574241181296,
      0.6944603731242996,
      0.6945056277056276,
      0.694505708245243,
      0.6966131754256106,
      0.69662,
      0.6968524421593829,
      0.6968566479340211,
      0.697513924050633,
      0.6975182795698924,
      0.697797457158651,
      0.6977977733152602,
      0.6995654986522911,
      0.6995662066616957,
      0.7002124529878813,
      0.7002167316612732,
      0.7020280323450134,
      0.7020286483921785,
      0.7064731517509727,
      0.7064742701281325,
      0.7084990099009901,
      0.7085011776435707,
      0.7098461367426349,
      0.7098515130904938,
      0.7122626506024096,
      0.712262653342647,
      0.7143354838709677,
      0.7143373848987108,
      0.7292000000000001,
      0.7292021532124229,
      0.7318935251798562,
      0.731898359347454,
      0.73854463840399,
      0.7385473684210527,
      0.7439946609406726,
      0.7440001789310575,
      0.7444891640866873,
      0.744493589640633,
      0.7450545018007202,
      0.7450567659081079,
      0.8830304347826087,
      0.8831708333333333,
      0.9062222222222222
    ],
    "y_thresholds": [
      0.0,
      0.0,
      0.0449438202247191,
      0.0449438202247191,
      0.059322033898305086,
      0.059322033898305086,
      0.0689655172413793,
      0.0689655172413793,
      0.0851063829787234,
      0.0851063829787234,
      0.10144927536231885,
      0.10144927536231885,
      0.1581196581196581,
      0.1581196581196581,
      0.1702127659574468,
      0.1702127659574468,
      0.2,
      0.2,
      0.2240437158469945,
      0.2240437158469945,
      0.2690476190476191,
      0.2690476190476191,
      0.29927007299270075,
      0.29927007299270075,
      0.3176470588235294,
      0.3176470588235294,
      0.3333333333333333,
      0.3333333333333333,
      0.34349030470914127,
      0.34349030470914127,
      0.34375,
      0.34375,
      0.3967611336032389,
      0.3967611336032389,
      0.39705882352941174,
      0.39705882352941174,
      0.4166666666666667,
      0.4166666666666667,
      0.4371859296482412,
      0.4371859296482412,
      0.4444444444444444,
      0.4444444444444444,
      0.45112781954887216,
      0.45112781954887216,
      0.48175182481751827,
      0.48175182481751827,
      0.488,
      0.488,
      0.5,
      0.5,
      0.5276595744680851,
      0.5276595744680851,
      0.5420420420420421,
      0.5420420420420421,
      0.5444839857651246,
      0.5444839857651246,
      0.5658536585365853,
      0.5658536585365853,
      0.5714285714285714,
      0.5714285714285714,
      0.6048192771084338,
      0.6048192771084338,
      0.6406593406593407,
      0.6406593406593407,
      0.6551724137931034,
      0.6551724137931034,
      0.7071290944123314,
      0.7071290944123314,
      0.7308377896613191,
      0.7308377896613191,
      0.739202657807309,
      0.739202657807309,
      0.7414829659318637,
      0.7414829659318637,
      0.7542087542087542,
      0.7542087542087542,
      0.76,
      0.76,
      0.7666463042150274,
      0.7666463042150274,
      0.7681564245810056,
      0.7681564245810056,
      0.8141025641025641,
      0.8141025641025641,
      0.8296529968454258,
      0.8296529968454258,
      0.8434065934065934,
      0.8434065934065934,
      0.8516706740734599,
      0.8516706740734599,
      0.8571428571428571,
      0.8571428571428571,
      0.8620689655172413,
      0.8620689655172413,
      0.8666666666666667,
      0.8666666666666667,
      0.8732394366197183,
      0.8732394366197183,
      0.9009433962264151,
      0.9009433962264151,
      0.9075,
      0.9075,
      0.9135802469135802,
      0.9135802469135802,
      0.9166666666666666,
      0.9166666666666666,
      0.924,
      0.924,
      0.936,
      0.936,
      0.9380530973451328,
      0.9380530973451328,
      0.9461077844311377,
      0.9461077844311377,
      0.94994994994995,
      0.94994994994995,
      0.9515669515669516,
      0.9515669515669516,
      0.9533980582524272,
      0.9533980582524272,
      0.9670886075949368,
      0.9670886075949368,
      0.9788797061524335,
      0.9788797061524335,
      0.9804941482444733,
      0.9804941482444733,
      0.9814814814814815,
      0.9814814814814815,
      0.9829706717123936,
      0.9829706717123936,
      0.9861900893582454,
      0.9861900893582454,
      0.9896661367249603,
      0.9896661367249603,
      0.9908515130190007,
      0.9908515130190007,
      0.9929111531190926,
      0.9929111531190926,
      0.9947089947089947,
      0.9947089947089947,
      0.9953917050691244,
      0.9953917050691244,
      0.995714965878432,
      0.995714965878432,
      1.0,
      1.0
    ]
  },
  "bundle_id": "defactify-text-v1",
  "cohort": "defactify-text (Roy et al. 2026; NYT human + 6 LLM families; hygiene-filtered)",
  "conformal": {
    "alpha": 0.1,
    "threshold": 0.5443037974683546
  },
  "corpus": {
    "families": [
      "gemma-2-9b",
      "gpt-4o",
      "human",
      "llama-8b",
      "mistral-7b",
      "qwen-2-72b",
      "yi-large"
    ],
    "geometry_dropped_families": [],
    "geometry_min_family_n": 8,
    "n_ai": 62183,
    "n_human": 9483,
    "n_records": 71666,
    "n_text_records": 71666
  },
  "created_utc": "2026-08-12T21:45:39Z",
  "dataset_manifest_id": "defactify-text",
  "detector_id": "heuristic-prose-detector",
  "detector_version": "0.1.0",
  "feature_names": [
    "long_words",
    "connectors",
    "unique_ratio",
    "short_sentences",
    "structured",
    "digits",
    "balanced_lines"
  ],
  "feature_schema": "panoptes-attribution-features-v1",
  "metrics": {
    "auroc": 0.8467703683963477,
    "brier": 0.08409386296915623,
    "ece": 0.0018855245533818247,
    "tpr_at_1fpr": 0.264863387099368,
    "tpr_at_5fpr": 0.5526751684544007
  },
  "reliability_bins": [
    {
      "bin_hi": 0.1,
      "bin_lo": 0.0,
      "mean_predicted": 0.06253796461609687,
      "n": 624,
      "observed": 0.07051282051282051
    },
    {
      "bin_hi": 0.2,
      "bin_lo": 0.1,
      "mean_predicted": 0.15959820858293564,
      "n": 526,
      "observed": 0.15399239543726237
    },
    {
      "bin_hi": 0.30000000000000004,
      "bin_lo": 0.2,
      "mean_predicted": 0.2555109325395422,
      "n": 663,
      "observed": 0.2684766214177979
    },
    {
      "bin_hi": 0.4,
      "bin_lo": 0.30000000000000004,
      "mean_predicted": 0.34601058164043014,
      "n": 1008,
      "observed": 0.3482142857142857
    },
    {
      "bin_hi": 0.5,
      "bin_lo": 0.4,
      "mean_predicted": 0.45103619495744757,
      "n": 1052,
      "observed": 0.45627376425855515
    },
    {
      "bin_hi": 0.6000000000000001,
      "bin_lo": 0.5,
      "mean_predicted": 0.5434818540646452,
      "n": 2026,
      "observed": 0.5345508390918066
    },
    {
      "bin_hi": 0.7000000000000001,
      "bin_lo": 0.6000000000000001,
      "mean_predicted": 0.6443659863812642,
      "n": 1811,
      "observed": 0.6482606294864716
    },
    {
      "bin_hi": 0.8,
      "bin_lo": 0.7000000000000001,
      "mean_predicted": 0.7522244165394558,
      "n": 5378,
      "observed": 0.7566009669021941
    },
    {
      "bin_hi": 0.9,
      "bin_lo": 0.8,